{
  "eventId": "11111111-1111-4111-8111-111111111111",
  "eventType": "sla.breached",
  "schemaVersion": 1,
  "tenantId": "tenant-demo",
  "correlationId": "corr-sla-breach",
  "causationId": "22222222-2222-4222-8222-222222222222",
  "aggregateType": "SlaInstance",
  "aggregateId": "33333333-3333-4333-8333-333333333333",
  "aggregateVersion": 2,
  "occurredAt": "2026-07-16T01:00:10Z",
  "payload": {
    "slaInstanceId": "33333333-3333-4333-8333-333333333333",
    "taskId": "44444444-4444-4444-8444-444444444444",
    "deadlineAt": "2026-07-16T01:00:00Z",
    "breachedAt": "2026-07-16T01:00:00Z",
    "detectedAt": "2026-07-16T01:00:10Z"
  }
}
